emoji,hexcode,group,subgroups,annotation,tags,openmoji_tags,openmoji_author,openmoji_date,skintone,skintone_combination,skintone_base_emoji,skintone_base_hexcode,unicode,order
🫪,1FAEA,smileys-emotion,face-concerned,distorted face,"anxiety, bloated, panic, shocked, surprised, vulnerable",,,,,,,,17,91
🫯,1FAEF,smileys-emotion,emotion,fight cloud,"argument, brawl, debate, disagreement, fight, ruckus, wrestle",,,,,,,,17,170
🫈,1FAC8,people-body,person-fantasy,hairy creature,"bigfoot, cryptid, forest, giant, hairy, sasquatch, woodwose, yeti",,,,,,,,17,1891
🧑‍🩰,1F9D1-200D-1FA70,people-body,person-activity,ballet dancer,"ballet, dancer",,,,,single,🧑‍🩰,1F9D1-200D-1FA70,17,2414
🪊,1FA8A,objects,musical-instrument,trombone,"brass, instrument, jazz, music, sad, slide",,,,,,,,17,4402
🪎,1FA8E,objects,money,treasure chest,"gem, gold, jewels, loot, money, prize, silver, valuables, wealth",,,,,,,,17,4479
